Recipe ID,Title,Ingredients
938,Super Simple Sea Bass,carrot | fresh ginger | whole garlic cloves | spring onions | lemon grass | shaoxing wine | shaoxing wine | shaoxing wine | soy sauce | sugar | null | null
939,Pan-roasted Sea Bass with Citrus-Heirloom Tomato Vinaigrette,black pepper | black pepper | fresh thyme | heirloom tomato | lemon juice | lemon peel | extra virgin olive oil | olive oil | fresh flat leaf parsley | red wine vinegar | table salt | seabass fillets | seabass fillets | coarse sea salt | sugar
940,Striped Bass with Sweet Carrots and Cider Glaze,apple cider | carrot | apple cider vinegar | whole garlic cloves | extra virgin olive oil | parsley | rosemary | salt and pepper | white fish fillets | unsalted butter | vegetable oil
942,Baketard.com - Blog - Giorgio Locatelli's Branzino alla Vernaccia in Crosta Di Pomodoro (Sea Bass with Tomato Crust and Vernaccia Wine),artichoke | european seabass | hawaiian rock cod | hawaiian rock cod | european seabass | breadcrumbs | butter | extra virgin olive oil | fish | fish stock | food color | green olives | cream | lemon juice | olive oil | parsley | salt and pepper | seabass fillets | seabass fillets | seabass fillets | seabass fillets | sun dried tomatoes | tomato | tomato | white onion | dry white wine | fish | dry white wine | null | null | null | null | null | null
943,Steamed Striped Bass With Ginger And Scallions,canola oil | cilantro | fresh ginger | cooked rice | cooked rice | cooked rice | spring onions | soy sauce | striped bass
944,Pan-roasted Striped Bass With "ratatouille,cherry tomato | eggplant | grape seed oil | lemon juice | olive oil | salt and pepper | shallot | striped bass | yellow squash
945,Sea Bass with Tomato and Black Olive Salsa,fresh basil | fresh basil | dill | grape tomato | kalamata olives | lemon juice | extra virgin olive oil | red chili pepper | salt and pepper | seabass fillets | seabass fillets
946,Steamed Striped Bass,striped bass | coarse salt | fresh ginger | ground coriander | orange juice | black pepper | shaoxing wine | shaoxing wine | shaoxing wine | spring onions | sesame oil | pasta shells | shiitake mushrooms | soy sauce
947,Ginger-Miso Striped Bass in Shiitake Mushroom Broth,cilantro | fresh ginger | spring onions | panko | red miso | shiitake mushrooms | striped bass | vegetable oil | water
948,Sake-Steamed Sea Bass with Ginger and Green Onions,clam juice | cilantro | whole garlic cloves | ginger | spring onions | sesame oil | medium grain rice | shaoxing wine | shaoxing wine | shaoxing wine | seabass fillets | seabass fillets | sesame seeds | soy sauce
949,Grilled Striped Bass with Orange-Saffron Butter,butter | kosher salt | orange juice concentrate | orange | saffron | striped bass | white wine vinegar
951,Sautéed Bass With Mint Pesto And Spiced Carrots,carrot | kosher salt | whole coriander seeds | cumin seeds | extra virgin olive oil | fennel seeds | mint | mint | fresh thyme | whole garlic cloves | lemon juice | low sodium chicken broth | extra virgin olive oil | red pepper flakes | striped bass | unsalted pistachios
953,Steamed Sea Bass With Ginger And Shiitakes,ground cayenne pepper | chili oil | chili oil | cilantro | cilantro | fresh ginger | spring onions | seabass fillets | seabass fillets | coarse sea salt | shiitake mushrooms | soy sauce
954,Stuffed Seabass,new potato | butter | capers | fennel | fennel seeds | flat leaf parsley | fresh basil | fresh basil | dill | mint | whole garlic cloves | lemon | olive oil | seabass fillets | seabass fillets | black tea bag | tomato and basil sauce | dry white wine
956,Spiced Sea Bass With Caramelised Fennel,butter | chili pepper | fennel | whole garlic cloves | lemon peel | olive oil | seabass fillets | seabass fillets
957,Striped Bass With Sage And Red-wine Butter,black pepper | canola oil | coarse salt | garlic | lemon juice | red wine | port wine | red snapper | red snapper | red snapper | wine vinegar | sage | shallot | unsalted butter | wondra flour
958,Grilled Striped Bass,coarse salt | whole garlic cloves | lemon juice | lemon juice | extra virgin olive oil | black pepper | black pepper | striped bass | striped bass | oregano
959,Steamed Asian Sea Bass In The Bag,chili pepper | cilantro | egg whites | garlic | ginger | kaffir lime leaves | lemon grass | lime peel | olive oil | wine | seabass fillets | seabass fillets | soy sauce
960,Striped Bass With Lime Butter,canola oil | dry white wine | wheat flour | fresh parsley | cream | kosher salt | lime juice | red potato | black pepper | red snapper | red snapper | red snapper | shallot | unsalted butter
962,"Seared Black Bass with Bitter Greens, Grapefruit and Feta Salad","feta cheese | grapefruit | mesclun | kalamata olives | kosher salt | extra virgin olive oil | red grapefruit | red onion | black bass"
963,Broiled Sea Bass with Pineapple-Chili-Basil Glaze,black pepper | red pepper flakes | whole garlic cloves | pineapple jam | rice vinegar | table salt | white fish fillets | dried basil
964,Pesto-Marinated Striped Bass with Warm Tomatoes,grape tomato | kosher salt | basil pesto | red pepper flakes | striped bass | dry white wine
965,Sea Bass With Brown Shrimps & Couscous,ribs | baking mix | baking mix | banana shallot | barbecue seasoning | cookies | sausage links | brownie mix | cheddar cheese soup | chex mix | chex mix | chex mix | chocolate eggs | cooking oil | couscous | milk substitute | dill | elk roast | fish | flat iron steak | food color | food color | food color | food color | food color | food color | fresh flat leaf parsley | mixed fruit | golden brown sugar | golden brown sugar | greek yogurt | sprinkles | sprinkles | sprinkles | reduced fat and reduced sodium cream of celery soup | reduced fat and reduced sodium cream of celery soup | reduced fat and reduced sodium cream of celery soup | lemon peel | light mayonnaise | meat | mexican crema | olive oil | pasta | refrigerated pie crust | red wine vinegar | mixed vegetables | mixed vegetables | seabass fillets | seabass fillets | shrimp | spring mix | steel cut oats | sugar | summer squash | tea | soy cheese | veggie bacon | veggie bacon | deli turkey | deli turkey | winter squash | oven ready lasagne noodles | null | null
967,Oven-roasted Striped Bass with Peppers,black pepper | chicken broth | fresh rosemary | whole garlic cloves | green pepper | olive oil | onion | oregano | red pepper | red pepper | table salt | striped bass | yellow pepper | red potato
968,Steamed Sea Bass Recipe (thai-style),basmati rice | chili pepper | unsweetened coconut milk | cilantro | garlic | ginger | lime juice | lime | seabass fillets | seabass fillets | black pepper | sesame oil | soy sauce | spring onions | sugar snap peas
969,Ginger-and-Lemon-Steamed Striped Bass with Fennel Salad,chives | fennel | fresh ginger | kosher salt | lemon | lemon juice | extra virgin olive oil | striped bass
970,"Roasted Sea Bass With Fennel, Blood Oranges & Olives","bay leaves | olives | blood orange | fennel | whole garlic cloves | halibut fillets | extra virgin olive oil | orange juice | orange zest | salt and pepper | dry white wine"
971,Grilled Sea Bass with Miso-Mustard Sauce,dijon mustard | spring onions | shaoxing wine | shaoxing wine | shaoxing wine | olive oil | rice vinegar | seabass fillets | seabass fillets | sesame seeds | soy sauce | sugar | water | white miso
972,Sea Bass With Swiss Chard & Beurre Blanc,banana shallot | butter | whole coriander seeds | creme fraiche | fennel | fennel seeds | fish stock | lemon | yellow mustard seeds | seabass fillets | seabass fillets | star anise | swiss chard | vanilla bean | white balsamic vinegar
973,Whole Striped Bass,black pepper | dill | fresh parsley | kosher salt | lemon | olive oil | onion | striped bass
974,Roasted Mushroom-Stuffed Striped Bass,applewood smoked bacon | sage | jasmine rice | leek | lemon peel | lemon wedge | mixed mushrooms | olive oil | fresh flat leaf parsley | black pepper | coarse sea salt | red snapper | red snapper | red snapper | tomato | unsalted butter
975,Pan-Seared Sea Bass in Tomato Fennel Broth,carrot | fish stock | fennel | garlic | grape seed oil | ground fennel | extra virgin olive oil | onion | orange juice | black pepper | seabass fillets | seabass fillets | sun dried tomatoes | unsalted butter | dry white wine
977,Grilled Sea Bass Donburi,dashi | egg | seabass fillets | seabass fillets | korean bbq marinade | kosher salt | mirin | sugar
979,Whole Striped Bass with Lemon and Mint,whole garlic cloves | spring onions | lemon | lemon juice | mint | extra virgin olive oil | oregano | striped bass
980,Domestic Diva's Sea Bass With Roasted Eggplant Puree & Olive An,black olives | cherry tomato | eggplant | grape seed oil | olive oil | table salt | salt and pepper
981,Domestic Diva's Pan Seared Sea Bass With Tarragon Pesto & Chick,chickpeas | tarragon | whole garlic cloves | grape seed oil | lemon juice | olive oil | salt and pepper | seabass fillets | seabass fillets | walnuts
982,Sautéed Striped Bass with Summer Vegetables,black pepper | carrot | dried thyme | fennel | fresh basil | fresh basil | whole garlic cloves | olive oil | red onion | table salt | squash | striped bass | white wine vinegar | zucchini
983,Spice-Baked Sea Bass and Red Lentils,black pepper | dried green lentils | dried thyme | garlic | ground cumin | ginger powder | kosher salt | lemon juice | olive oil | seabass fillets | seabass fillets | low sodium vegetable broth | yellow onion
984,"Sea Bass with Fennel, Tomato and Orange","canned tomatoes | celery sticks | red pepper flakes | dry white wine | fennel | flat leaf parsley | extra virgin olive oil | onion | orange zest | saffron | seabass fillets | seabass fillets | coarse sea salt"
985,Striped Bass in Agrodolce Sauce,bay leaves | black pepper | dry red wine | farm raised catfish fillets | fennel | golden raisins | olive oil | table salt | shallot | sugar | water | white balsamic vinegar
987,Sea Bass and Cucumbers in Champagne Sauce,light cream | seedless cucumber | table salt | spring onions | seabass fillets | seabass fillets | sparkling wine
989,Smoky-Spicy Bass,black bass | ground cayenne pepper | cilantro | granulated garlic | granulated onion | lemon wedge | mustard | parsley | black pepper | smoked paprika | vegetable oil
990,Sea Bass alla Fiorentina,black pepper | crushed tomatoes | wheat flour | fresh basil | fresh basil | fresh parsley | whole garlic cloves | extra virgin olive oil | seasoning | seabass fillets | seabass fillets | water
991,Shiso Wrapped Bass Dumplings In Dashi,dashi | korean bbq marinade | mirin | fresh mushrooms | fresh mushrooms | table salt | spring onions | seabass fillets | seabass fillets | shiso leaves | soy sauce | wonton wrappers | wonton wrappers
992,Corvina Traditional,aji amarillo chili paste | celery | cilantro | cod fillets | cilantro | juice | lime juice | maple syrup | red onion | table salt | sweet potato
993,Sake Steamed Bass,fresh ginger | kosher salt | lime | lemon grass | shaoxing wine | shaoxing wine | shaoxing wine | striped bass
994,"Whole Branzino In Grape Leaves With Zucchini, Olives, And Mint","european seabass | salt and pepper | mint | grape leaves | green olives | lemon | extra virgin olive oil | zucchini"
996,Seared Sea Bass With Fennel Seeds & Roasted Sweet Potatoes,fennel seeds | food color | olive oil | seabass fillets | seabass fillets | sweet potato | null
997,Blue Corn Crusted Black Bass,black pepper | butter | buttermilk | corn tortilla chips | wheat flour | garlic powder | granulated sugar | juice | red wine vinegar | table salt | black bass | vegetable oil
1000,Pistachio Sea Bass with Crab Salad,coconut | curry powder | egg whites | fleur de sel | lime juice | lump crabmeat | pistachio oil | unsalted pistachios | spring onions | seabass fillets | seabass fillets | seabass fillets | seabass fillets | vegetable oil
1001,Wild Striped Bass with Scallions and Herb Salad,chives | red pepper flakes | dill | flat leaf parsley | tarragon | salt and pepper | lemon juice | lemon peel | mint | extra virgin olive oil | orange juice | spring onions | striped bass | unsalted butter | walnut oil
1002,Sea Bass with Tomatoes and Olives,black pepper | butter | chicken broth | dry white wine | fresh thyme | garlic | kalamata olives | kosher salt | lemon peel | olive oil | parsley | quinoa | salmon fillets | sugar | cherry tomato
1003,Grilling: Striped Bass with Roasted Salsa,black pepper | chili powder | cilantro | extra virgin olive oil | whole garlic cloves | granulated garlic | ground cumin | jalapeno pepper | kosher salt | lime juice | oregano | plum tomato | red onion | striped bass
1004,"Salt-Baked Branzino with Citrus, Fennel and Herbs","cilantro | egg whites | fennel | kosher salt | lemon wedge | orange | parsley | rosemary | seabass fillets | seabass fillets"
1006,Grilled Sea Bass,butter | extra virgin olive oil | flat leaf parsley | garlic | garlic powder | lemon pepper | onion powder | paprika | seabass fillets | seabass fillets | coarse sea salt
1007,Catalan Roasted Sea Bass,black pepper | canned tomatoes | dry white wine | extra virgin olive oil | garlic | kalamata olives | kosher salt | onion | orange zest | oregano | flat leaf parsley | seabass fillets | seabass fillets
1008,Spicy Butter-Steamed Bass,cilantro | fresh ginger | whole garlic cloves | lime juice | red snapper | red snapper | red snapper | salt and pepper | serrano pepper | unsalted butter
1009,Miso And Soy Chilean Sea Bass,golden brown sugar | golden brown sugar | spring onions | shaoxing wine | shaoxing wine | shaoxing wine | miso | shaoxing wine | shaoxing wine | shaoxing wine | seabass fillets | seabass fillets | soy sauce
1010,Whole Black Bass with Ginger and Scallions,fresh ginger | light soy sauce | table salt | spring onions | seabass fillets | seabass fillets | sugar | vegetable oil
1011,Roasted Striped Bass With Chive And Sour Cream Sauce,chives | chives | garlic | lemon | lemon juice | table salt | sour cream | striped bass | vegetable oil | water
1013,"Roasted Bass with Potatoes, Onions and Fennel","fennel | russet potato | lemon juice | extra virgin olive oil | olive oil | red pepper | black pepper | sesame seeds | striped bass | water | white onion"
1014,Sea Bass With Shiitake Mushroom Butter,chili pepper | whole garlic cloves | light soy sauce | soy sauce | seabass fillets | seabass fillets | shiitake mushrooms | spring onions | unsalted butter
1015,Steamed Wild Striped Bass with Ginger and Scallions,cilantro | douchi | fresh ginger | jalapeno pepper | shaoxing wine | shaoxing wine | shaoxing wine | white pepper | spring onions | sesame oil | soy sauce | striped bass | sugar | vegetable oil
1016,Grilled Bass with Green Tomato and Watermelon Salsa,cilantro | green tomato | lime juice | olive oil | red onion | table salt | striped bass | thai chili | watermelon
1019,Oven-Roasted Sea Bass with Couscous and Warm Tomato Vinaigrette,black pepper | couscous | fat free chicken broth | chives | whole garlic cloves | spring onions | halibut fillets | kosher salt | lemon | lemon juice | olive oil | sherry vinegar | tomato
1020,Wood-Roasted Striped Bass with Meyer Lemon and Olive Relish,black olives | garlic | kosher salt | lemon juice | meyer lemon | olive oil | extra virgin olive oil | parsley | table salt | shallot | striped bass | spring onions
1021,"Slashed Sea Bass with Red Onions, Mushrooms, and New Potatoes","butter | chervil | chili oil | lemon juice | new potato | black pepper | basil pesto | portobello mushrooms | red onion | seabass fillets | seabass fillets | coarse sea salt"
1022,Steamed Sea Bass with Tamarind Sauce,whole coriander seeds | cumin seeds | roasted peanuts | fish | whole garlic cloves | ginger | harissa | lime juice | mint | pearl onion | salt and pepper | spring onions | seabass fillets | seabass fillets | tamarind pulp | unsalted butter | unsweetened coconut milk | water
1023,Whole Roasted Sea Bass with Potatoes and Olives,russet potato | dry white wine | flat leaf parsley | grape tomato | extra virgin olive oil | olives | red snapper | red snapper | red snapper | rosemary | salt and pepper | fresh thyme
1025,"Steamed Sea Bass with Vanilla, Baby Vegetables and Cappuccino Sauce","baby leeks | fava beans | petite peas | lemon juice | new potato | extra virgin olive oil | seabass fillets | seabass fillets | black pepper | 2 percent milk | vanilla bean"
1026,Baked Seabass with Homemade Garlic Butter and Herb Bread Crumb Topping,fresh parsley | garlic | lemon peel | black pepper | seabass fillets | seabass fillets | sourdough bread | thyme | unsalted butter
1027,Seared Sea Bass with Spicy Lemongrass Crust,corn starch | fish sauce | garlic | granulated sugar | granulated sugar | green curry paste | kosher salt | lemon juice | lemon grass | low sodium chicken broth | red pepper flakes | seabass fillets | seabass fillets | turmeric | turmeric | unsweetened coconut milk | vegetable oil | water
1028,Seared Wild Striped Bass with Sauteed Spring Vegetables,asparagus | fava beans | garlic | morel mushrooms | extra virgin olive oil | table salt | striped bass | sugar snap peas | vegetable stock
1029,"Pan-Roasted Striped Bass with Roasted Artichokes, Mushrooms, and Tomato Marmalade","baby artichoke | baby arugula | black pepper | fennel | fennel pollen | meyer lemon | extra virgin olive oil | striped bass | sun dried tomatoes | thyme | null | null"
1030,Alma's Striped Bass Seviche,anaheim pepper | grapefruit juice | ground coriander | ground cumin | lemon juice | lime juice | black pepper | red onion | table salt | sparkling wine | striped bass
1031,Roasted Striped Bass,black pepper | canned tomatoes | dry white wine | fresh flat leaf parsley | garlic | kosher salt | mussels | olive oil | pancetta | pernod | saffron | shrimp | striped bass | yellow onion
1033,Sea Bass Fillets with Parsley Sauce,breadcrumbs | creme fraiche | egg | flat leaf parsley | wheat flour | lemon juice | low sodium chicken stock | extra virgin olive oil | salt and pepper | seabass fillets | seabass fillets | shallot | unsalted butter
1034,Sea Bass all'Acqua Pazza,bay leaves | carrot | celery sticks | dry white wine | whole garlic cloves | kosher salt | extra virgin olive oil | onion | parsley | black pepper | seabass fillets | seabass fillets | water
1037,Smoked Black Bass,black pepper | cilantro | whole garlic cloves | lime | lime wedge | extra virgin olive oil | table salt | spring onions | seabass fillets | seabass fillets | black tea bag | null | null
1038,Macadamia-crusted Sea Bass With Mango Cream Sauce,black pepper | black pepper | extra virgin olive oil | extra virgin olive oil | garlic | black pepper | cream | lemon juice | lemon juice | macadamia nuts | mango | olive oil | olive oil | red pepper flakes | seabass fillets | seabass fillets | seabass fillets | seabass fillets | seasoned breadcrumbs
1040,Sauteed Striped Bass with Mint Pesto and Spiced Carrots,carrot | kosher salt | whole coriander seeds | cumin seeds | fennel seeds | mint | mint | fresh thyme | whole garlic cloves | lemon juice | low sodium chicken broth | extra virgin olive oil | extra virgin olive oil | extra virgin olive oil | pistachio nuts | red pepper flakes | striped bass
1041,Bass in Artichoke and Tomato Broth,black pepper | canned tomatoes | dry white wine | frozen artichoke hearts | whole garlic cloves | kalamata olives | extra virgin olive oil | onion | orange zest | table salt | seabass fillets | seabass fillets | unsalted butter | water
1042,Salt-Baked Sea Bass with Warm Tomato Vinaigrette,cherry tomato | low sodium chicken broth | egg whites | flat leaf parsley | whole garlic cloves | kosher salt | lemon | extra virgin olive oil | black pepper | saffron | seabass fillets | seabass fillets | shallot | sherry vinegar
1043,Striped Bass Meunière,black pepper | butter | fat free chicken broth | wheat flour | fresh parsley | 2 percent milk | table salt | shallot | striped bass | white balsamic vinegar
1044,Striped Bass with Caramelized Brussels Sprouts,brussels sprouts | whole garlic cloves | grouper | lemon juice | lemon peel | mayonnaise | extra virgin olive oil | pancetta | salt and pepper | sweet paprika | fresh thyme | vegetable oil
1046,Roasted Black Sea Bass with Tomato and Olive Salad,anchovy paste | cherry tomato | whole garlic cloves | grape tomato | kalamata olives | extra virgin olive oil | extra virgin olive oil | oregano | oregano | red onion | wine vinegar | seabass fillets | seabass fillets | sun dried tomatoes
1047,"Sea Bass with Saffron, Sherry and Pine Nuts","golden raisins | pine nuts | saffron | seabass fillets | seabass fillets | coarse sea salt | sherry | water"
1048,Black Bass with Sicilian-Style Pesto,almonds | fresh basil | fresh basil | butter | celery | extra virgin olive oil | garlic | orange zest | oregano | parsley | table salt | spring onions | seabass fillets | seabass fillets | sun dried tomatoes | dry white wine
1049,Sautéed Bass with Lemongrass,dry white wine | whole garlic cloves | cream | leek | lemon juice | lemon peel | lemon grass | extra virgin olive oil | salt and pepper | spring onions | seabass fillets | seabass fillets | shallot | thyme | tomato | unsalted butter | vegetable oil
1051,Chinese-style Steamed Bass,chili pepper | fresh ginger | garlic | ginger | lime | shaoxing wine | shaoxing wine | shaoxing wine | table salt | spring onions | seabass fillets | seabass fillets | sesame oil | soy sauce | vegetable oil
1052,Pan Fried Sea Bass,asparagus | butter | fresh thyme | cream | olive oil | saffron | black pepper | seabass fillets | seabass fillets | riesling | riesling
1053,Baked Bass with Romano Cheese,breadcrumbs | fresh parsley | garlic powder | lemon juice | olive oil | pecorino romano | trout fillets
1054,Risotto With Sea Bass And Fennel,celery sticks | dry white wine | fennel | fish stock | whole garlic cloves | extra virgin olive oil | rice | salt and pepper | seabass fillets | seabass fillets | unsalted butter | yellow onion
1055,Saucy Fish Tacos,cilantro | white corn tortilla | white corn tortilla | garlic | garlic salt | cabbage | black pepper | lime peel | low fat plain yogurt | olive oil | peach | pistachio nuts | poblano pepper | red pepper | seabass fillets | seabass fillets
1056,Sea Bass Crusted with Moroccan Spices,black pepper | caraway seeds | red pepper flakes | cilantro | whole garlic cloves | ground coriander | ground cumin | lemon juice | olive oil | paprika | table salt | seabass fillets | seabass fillets
1060,Seabass Tartar On Warm Zucchini Cream With Tomato Caviar,extra virgin olive oil | fish stock | lemon juice | olive oil | salt and pepper | seabass fillets | seabass fillets | soy sauce | tomato | baby zucchini
1062,Pan-Seared Striped Bass All'amatriciana,balsamic vinegar | cherry tomato | red pepper flakes | whole garlic cloves | extra virgin olive oil | onion | pancetta | striped bass | table salt
1063,Sea Bass With Asparagus,asparagus | fish | fresh ginger | lower sodium soy sauce | shaoxing wine | shaoxing wine | shaoxing wine | salt and pepper | shiitake mushrooms
1064,McDevitt's Miso-Marinated Sea Bass,artichoke | chives | curry powder | dijon mustard | fresh ginger | fresh ginger | whole garlic cloves | ginger | hot sauce | lemon | lime juice | lime juice | mayonnaise | mirin | yellow miso | olive oil | plum tomato | red onion | rice vinegar | shaoxing wine | shaoxing wine | shaoxing wine | salt and pepper | salt and pepper | spring onions | seabass fillets | seabass fillets | soy sauce | soybeans | turmeric | water | dry white wine
1065,Yagihashi's Black Sea Bass with Somen and Vegetables,fresh basil | fresh basil | black sesame seeds | carrot | chives | cilantro | daikon radish | fresh ginger | jalapeno pepper | kelp | lemon grass | mirin | bean sprouts | napa cabbage | pasta | onion | red onion | shaoxing wine | shaoxing wine | shaoxing wine | salt and pepper | seabass fillets | seabass fillets | sesame oil | shiitake mushrooms | snow peas | soy sauce | soy sauce | vegetable oil | vegetable oil | water
1066,Sea Bass Crudo With Peruvian Tiradito Sauce,aji amarillo | aloe vera juice | cilantro | clam juice | corn kernels | food color | food color | garlic | lemon juice | lime juice | riesling | riesling | seabass fillets | seabass fillets | seabass fillets | seabass fillets | seabass fillets | seabass fillets | seabass fillets | seabass fillets | soy sauce | vegetable oil | wine | yellow pepper
1068,Sea Bass and Confetti Vegetables with Lemon-Butter Sauce,baby spinach | butter | corn kernels | dry white wine | fresh parsley | grouper | lemon juice | plum tomato | table salt
1069,Roast Sea Bass With Chilli & Lime Leaves,anise | fennel | cilantro | cilantro | whole garlic cloves | whole garlic cloves | lemon grass | lemon grass | kaffir lime leaves | kaffir lime leaves | red chili pepper | red chili pepper | red onion | red onion | sunflower oil | sunflower oil | sunflower oil | thai fish sauce | thai fish sauce | seabass fillets | seabass fillets | seabass fillets | seabass fillets
1070,Striped Bass en Papillote,red pepper | black pepper | feta cheese | fresh parsley | lemon juice | olive oil | oregano | red onion | table salt | striped bass | yellow tomato | zucchini
1071,Cedar Plank Grilled Loup De Mer (sea Bass),fresh basil | fresh basil | pimento stuffed green olives | cedar plank | kosher salt | lemon | olive oil | red onion | tomato | null | null | null | null
1072,Whole Branzino Roasted in Salt,arugula | capers | celery | kosher salt | cucumber | egg whites | fresh parsley | lemon | lemon | oil cured black olives | extra virgin olive oil | fresh parsley | seabass fillets | seabass fillets | fresh thyme
1073,Foshee's Striped Bass with Caramelized Onion Sauce,balsamic vinegar | chicken stock | chives | fava beans | whole garlic cloves | morel mushrooms | extra virgin olive oil | onion | white pepper | baby leeks | shallot | striped bass | fresh thyme | truffle oil | unsalted butter
